{
  "$schema": "https://json-schema.org/draft/2020-12/schema",
  "$id": "https://specification.powerd6.org/schemas/type.json",
  "title": "type",
  "type": "object",
  "description": "The aggregation of properties, their value-types and their rendering rules.",
  "properties": {
    "id": {
      "description": "The unique identifier of the type.",
      "type": "string"
    },
    "description": {
      "description": "The human-readable description of what the type represents.",
      "type": "string"
    },
    "schema": {
      "description": "The json-schema used to validate the type.",
      "$ref": "https://json-schema.org/draft/2020-12/schema"
    },
    "rendering": {
      "description": "The rendering code for all the supported formats.",
      "type": "object",
      "patternProperties": {
        "^[a-zA-Z0-9-_]{2,3}$": {
          "description": "The template to be used for the specified format",
          "type": "string"
        }
      }
    }
  },
  "required": [
    "id",
    "description"
  ],
  "additionalProperties": false
}